Page,Title,Price,Availability,Rating
1,A Light in the Attic,£51.77,In stock,Three
1,Tipping the Velvet,£53.74,In stock,One
1,Soumission,£50.10,In stock,One
1,Sharp Objects,£47.82,In stock,Four
1,Sapiens: A Brief History of Humankind,£54.23,In stock,Five
1,The Requiem Red,£22.65,In stock,One
1,The Dirty Little Secrets of Getting Your Dream Job,£33.34,In stock,Four
1,"The Coming Woman: A Novel Based on the Life of the Infamous Feminist, Victoria Woodhull",£17.93,In stock,Three
1,The Boys in the Boat: Nine Americans and Their Epic Quest for Gold at the 1936 Berlin Olympics,£22.60,In stock,Four
1,The Black Maria,£52.15,In stock,One
1,"Starving Hearts (Triangular Trade Trilogy, #1)",£13.99,In stock,Two
1,Shakespeare's Sonnets,£20.66,In stock,Four
1,Set Me Free,£17.46,In stock,Five
1,Scott Pilgrim's Precious Little Life (Scott Pilgrim #1),£52.29,In stock,Five
1,Rip it Up and Start Again,£35.02,In stock,Five
1,"Our Band Could Be Your Life: Scenes from the American Indie Underground, 1981-1991",£57.25,In stock,Three
1,Olio,£23.88,In stock,One
1,Mesaerion: The Best Science Fiction Stories 1800-1849,£37.59,In stock,One
1,Libertarianism for Beginners,£51.33,In stock,Two
1,It's Only the Himalayas,£45.17,In stock,Two
2,In Her Wake,£12.84,In stock,One
2,How Music Works,£37.32,In stock,Two
2,"Foolproof Preserving: A Guide to Small Batch Jams, Jellies, Pickles, Condiments, and More: A Foolproof Guide to Making Small Batch Jams, Jellies, Pickles, Condiments, and More",£30.52,In stock,Three
2,Chase Me (Paris Nights #2),£25.27,In stock,Five
2,Black Dust,£34.53,In stock,Five
2,Birdsong: A Story in Pictures,£54.64,In stock,Three
2,America's Cradle of Quarterbacks: Western Pennsylvania's Football Factory from Johnny Unitas to Joe Montana,£22.50,In stock,Three
2,Aladdin and His Wonderful Lamp,£53.13,In stock,Three
2,Worlds Elsewhere: Journeys Around Shakespeare’s Globe,£40.30,In stock,Five
2,Wall and Piece,£44.18,In stock,Four
2,The Four Agreements: A Practical Guide to Personal Freedom,£17.66,In stock,Five
2,The Five Love Languages: How to Express Heartfelt Commitment to Your Mate,£31.05,In stock,Three
2,The Elephant Tree,£23.82,In stock,Five
2,The Bear and the Piano,£36.89,In stock,One
2,Sophie's World,£15.94,In stock,Five
2,Penny Maybe,£33.29,In stock,Three
2,Maude (1883-1993):She Grew Up with the country,£18.02,In stock,Two
2,"In a Dark, Dark Wood",£19.63,In stock,One
2,Behind Closed Doors,£52.22,In stock,Four
2,You can't bury them all: Poems,£33.63,In stock,Two
3,Slow States of Collapse: Poems,£57.31,In stock,Three
3,Reasons to Stay Alive,£26.41,In stock,Two
3,Private Paris (Private #10),£47.61,In stock,Five
3,#HigherSelfie: Wake Up Your Life. Free Your Soul. Find Your Tribe.,£23.11,In stock,Five
3,Without Borders (Wanderlove #1),£45.07,In stock,Two
3,When We Collided,£31.77,In stock,One
3,"We Love You, Charlie Freeman",£50.27,In stock,Five
3,Untitled Collection: Sabbath Poems 2014,£14.27,In stock,Four
3,"Unseen City: The Majesty of Pigeons, the Discreet Charm of Snails & Other Wonders of the Urban Wilderness",£44.18,In stock,Four
3,Unicorn Tracks,£18.78,In stock,Three
3,"Unbound: How Eight Technologies Made Us Human, Transformed Society, and Brought Our World to the Brink",£25.52,In stock,One
3,Tsubasa: WoRLD CHRoNiCLE 2 (Tsubasa WoRLD CHRoNiCLE #2),£16.28,In stock,One
3,Throwing Rocks at the Google Bus: How Growth Became the Enemy of Prosperity,£31.12,In stock,Three
3,This One Summer,£19.49,In stock,Four
3,Thirst,£17.27,In stock,Five
3,The Torch Is Passed: A Harding Family Story,£19.09,In stock,One
3,The Secret of Dreadwillow Carse,£56.13,In stock,One
3,"The Pioneer Woman Cooks: Dinnertime: Comfort Classics, Freezer Food, 16-Minute Meals, and Other Delicious Ways to Solve Supper!",£56.41,In stock,One
3,The Past Never Ends,£56.50,In stock,Four
3,The Natural History of Us (The Fine Art of Pretending #2),£45.22,In stock,Three
4,The Nameless City (The Nameless City #1),£38.16,In stock,Four
4,The Murder That Never Was (Forensic Instincts #5),£54.11,In stock,Three
4,The Most Perfect Thing: Inside (and Outside) a Bird's Egg,£42.96,In stock,Four
4,"The Mindfulness and Acceptance Workbook for Anxiety: A Guide to Breaking Free from Anxiety, Phobias, and Worry Using Acceptance and Commitment Therapy",£23.89,In stock,Four
4,The Life-Changing Magic of Tidying Up: The Japanese Art of Decluttering and Organizing,£16.77,In stock,Three
4,"The Inefficiency Assassin: Time Management Tactics for Working Smarter, Not Longer",£20.59,In stock,Five
4,The Gutsy Girl: Escapades for Your Life of Epic Adventure,£37.13,In stock,One
4,The Electric Pencil: Drawings from Inside State Hospital No. 3,£56.06,In stock,One
4,The Death of Humanity: and the Case for Life,£58.11,In stock,Four
4,"The Bulletproof Diet: Lose up to a Pound a Day, Reclaim Energy and Focus, Upgrade Your Life",£49.05,In stock,Three
4,The Art Forger,£40.76,In stock,Three
4,The Age of Genius: The Seventeenth Century and the Birth of the Modern Mind,£19.73,In stock,One
4,The Activist's Tao Te Ching: Ancient Advice for a Modern Revolution,£32.24,In stock,Five
4,Spark Joy: An Illustrated Master Class on the Art of Organizing and Tidying Up,£41.83,In stock,Four
4,Soul Reader,£39.58,In stock,Two
4,Security,£39.25,In stock,Two
4,"Saga, Volume 6 (Saga (Collected Editions) #6)",£25.02,In stock,Three
4,"Saga, Volume 5 (Saga (Collected Editions) #5)",£51.04,In stock,Two
4,Reskilling America: Learning to Labor in the Twenty-First Century,£19.83,In stock,Two
4,"Rat Queens, Vol. 3: Demons (Rat Queens (Collected Editions) #11-15)",£50.40,In stock,Three
5,"Princess Jellyfish 2-in-1 Omnibus, Vol. 01 (Princess Jellyfish 2-in-1 Omnibus #1)",£13.61,In stock,Five
5,Princess Between Worlds (Wide-Awake Princess #5),£13.34,In stock,Five
5,"Pop Gun War, Volume 1: Gift",£18.97,In stock,One
5,"Political Suicide: Missteps, Peccadilloes, Bad Calls, Backroom Hijinx, Sordid Pasts, Rotten Breaks, and Just Plain Dumb Mistakes in the Annals of American Politics",£36.28,In stock,Two
5,Patience,£10.16,In stock,Three
5,"Outcast, Vol. 1: A Darkness Surrounds Him (Outcast #1)",£15.44,In stock,Four
5,orange: The Complete Collection 1 (orange: The Complete Collection #1),£48.41,In stock,One
5,Online Marketing for Busy Authors: A Step-By-Step Guide,£46.35,In stock,One
5,On a Midnight Clear,£14.07,In stock,Three
5,Obsidian (Lux #1),£14.86,In stock,Two
5,My Paris Kitchen: Recipes and Stories,£33.37,In stock,Two
5,Masks and Shadows,£56.40,In stock,Two
5,"Mama Tried: Traditional Italian Cooking for the Screwed, Crude, Vegan, and Tattooed",£14.02,In stock,Four
5,"Lumberjanes, Vol. 2: Friendship to the Max (Lumberjanes #5-8)",£46.91,In stock,Two
5,"Lumberjanes, Vol. 1: Beware the Kitten Holy (Lumberjanes #1-4)",£45.61,In stock,Three
5,Lumberjanes Vol. 3: A Terrible Plan (Lumberjanes #9-12),£19.92,In stock,Two
5,"Layered: Baking, Building, and Styling Spectacular Cakes",£40.11,In stock,One
5,Judo: Seven Steps to Black Belt (an Introductory Guide for Beginners),£53.90,In stock,Two
5,Join,£35.67,In stock,Five
5,In the Country We Love: My Family Divided,£22.00,In stock,Four
6,Immunity: How Elie Metchnikoff Changed the Course of Modern Medicine,£57.36,In stock,Five
6,"I Hate Fairyland, Vol. 1: Madly Ever After (I Hate Fairyland (Compilations) #1-5)",£29.17,In stock,Two
6,I am a Hero Omnibus Volume 1,£54.63,In stock,Three
6,How to Be Miserable: 40 Strategies You Already Use,£46.03,In stock,One
6,Her Backup Boyfriend (The Sorensen Family #1),£33.97,In stock,One
6,"Giant Days, Vol. 2 (Giant Days #5-8)",£22.11,In stock,Two
6,Forever and Forever: The Courtship of Henry Longfellow and Fanny Appleton,£29.69,In stock,Three
6,First and First (Five Boroughs #3),£15.97,In stock,Four
6,Fifty Shades Darker (Fifty Shades #2),£21.96,In stock,One
6,Everydata: The Misinformation Hidden in the Little Data You Consume Every Day,£54.35,In stock,Two
6,"Don't Be a Jerk: And Other Practical Advice from Dogen, Japan's Greatest Zen Master",£37.97,In stock,Two
6,Danganronpa Volume 1,£51.99,In stock,Four
6,Crown of Midnight (Throne of Glass #2),£43.29,In stock,Three
6,"Codename Baboushka, Volume 1: The Conclave of Death",£36.72,In stock,Four
6,Camp Midnight,£17.08,In stock,Four
6,Call the Nurse: True Stories of a Country Nurse on a Scottish Isle,£29.14,In stock,Five
6,Burning,£28.81,In stock,Three
6,Bossypants,£49.46,In stock,Two
6,"Bitch Planet, Vol. 1: Extraordinary Machine (Bitch Planet (Collected Editions))",£37.92,In stock,Two
6,"Avatar: The Last Airbender: Smoke and Shadow, Part 3 (Smoke and Shadow #3)",£28.09,In stock,Two
7,Algorithms to Live By: The Computer Science of Human Decisions,£30.81,In stock,One
7,A World of Flavor: Your Gluten Free Passport,£42.95,In stock,One
7,"A Piece of Sky, a Grain of Rice: A Memoir in Four Meditations",£56.76,In stock,Five
7,A Murder in Time,£16.64,In stock,One
7,A Flight of Arrows (The Pathfinders #2),£55.53,In stock,Five
7,A Fierce and Subtle Poison,£28.13,In stock,Four
7,A Court of Thorns and Roses (A Court of Thorns and Roses #1),£52.37,In stock,One
7,(Un)Qualified: How God Uses Broken People to Do Big Things,£54.00,In stock,Five
7,You Are What You Love: The Spiritual Power of Habit,£21.87,In stock,Four
7,"William Shakespeare's Star Wars: Verily, A New Hope (William Shakespeare's Star Wars #4)",£43.30,In stock,Four
7,Tuesday Nights in 1980,£21.04,In stock,Two
7,Tracing Numbers on a Train,£41.60,In stock,Three
7,Throne of Glass (Throne of Glass #1),£35.07,In stock,Three
7,Thomas Jefferson and the Tripoli Pirates: The Forgotten War That Changed American History,£59.64,In stock,One
7,Thirteen Reasons Why,£52.72,In stock,One
7,The White Cat and the Monk: A Retelling of the Poem “Pangur Bán”,£58.08,In stock,Four
7,The Wedding Dress,£24.12,In stock,One
7,The Vacationers,£42.15,In stock,Four
7,The Third Wave: An Entrepreneur’s Vision of the Future,£12.61,In stock,Five
7,The Stranger,£17.44,In stock,Four
8,The Shadow Hero (The Shadow Hero),£33.14,In stock,One
8,The Secret (The Secret #1),£27.37,In stock,Four
8,The Regional Office Is Under Attack!,£51.36,In stock,Five
8,The Psychopath Test: A Journey Through the Madness Industry,£36.00,In stock,Two
8,The Project,£10.65,In stock,One
8,The Power of Now: A Guide to Spiritual Enlightenment,£43.54,In stock,Two
8,The Omnivore's Dilemma: A Natural History of Four Meals,£38.21,In stock,Two
8,The Nerdy Nummies Cookbook: Sweet Treats for the Geek in All of Us,£37.34,In stock,Five
8,The Murder of Roger Ackroyd (Hercule Poirot #4),£44.10,In stock,Four
8,The Mistake (Off-Campus #2),£43.29,In stock,Three
8,The Matchmaker's Playbook (Wingmen Inc. #1),£55.85,In stock,One
8,The Love and Lemons Cookbook: An Apple-to-Zucchini Celebration of Impromptu Cooking,£37.60,In stock,Two
8,The Long Shadow of Small Ghosts: Murder and Memory in an American City,£10.97,In stock,One
8,The Kite Runner,£41.82,In stock,Four
8,The House by the Lake,£36.95,In stock,One
8,The Glittering Court (The Glittering Court #1),£44.28,In stock,One
8,The Girl on the Train,£55.02,In stock,Two
8,The Genius of Birds,£17.24,In stock,One
8,The Emerald Mystery,£23.15,In stock,Two
8,The Cookies & Cups Cookbook: 125+ sweet & savory recipes reminding you to Always Eat Dessert First,£41.25,In stock,One
9,The Bridge to Consciousness: I'm Writing the Bridge Between Science and Our Old and New Beliefs.,£32.00,In stock,Three
9,The Artist's Way: A Spiritual Path to Higher Creativity,£38.49,In stock,Five
9,The Art of War,£33.34,In stock,Five
9,The Argonauts,£10.93,In stock,Two
9,The 10% Entrepreneur: Live Your Startup Dream Without Quitting Your Day Job,£27.55,In stock,Three
9,Suddenly in Love (Lake Haven #1),£55.99,In stock,Two
9,Something More Than This,£16.24,In stock,Four
9,Soft Apocalypse,£26.12,In stock,Two
9,So You've Been Publicly Shamed,£12.23,In stock,Two
9,Shoe Dog: A Memoir by the Creator of NIKE,£23.99,In stock,Two
9,"Shobu Samurai, Project Aryoku (#3)",£29.06,In stock,Three
9,Secrets and Lace (Fatal Hearts #1),£20.27,In stock,One
9,Scarlett Epstein Hates It Here,£43.55,In stock,Five
9,Romero and Juliet: A Tragic Tale of Love and Zombies,£36.94,In stock,One
9,Redeeming Love,£20.47,In stock,Five
9,Poses for Artists Volume 1 - Dynamic and Sitting Poses: An Essential Reference for Figure Drawing and the Human Form,£41.06,In stock,One
9,Poems That Make Grown Women Cry,£14.19,In stock,Four
9,"Nightingale, Sing",£38.28,In stock,One
9,Night Sky with Exit Wounds,£41.05,In stock,One
9,Mrs. Houdini,£30.25,In stock,Five
10,Modern Romance,£28.26,In stock,Five
10,Miss Peregrine’s Home for Peculiar Children (Miss Peregrine’s Peculiar Children #1),£10.76,In stock,One
10,Louisa: The Extraordinary Life of Mrs. Adams,£16.85,In stock,Two
10,Little Red,£13.47,In stock,Three
10,Library of Souls (Miss Peregrine’s Peculiar Children #3),£48.56,In stock,Five
10,Large Print Heart of the Pride,£19.15,In stock,Two
10,I Had a Nice Time And Other Lies...: How to find love & sh*t like that,£57.36,In stock,Four
10,Hollow City (Miss Peregrine’s Peculiar Children #2),£42.98,In stock,One
10,Grumbles,£22.16,In stock,Two
10,Full Moon over Noah’s Ark: An Odyssey to Mount Ararat and Beyond,£49.43,In stock,Four
10,Frostbite (Vampire Academy #2),£29.99,In stock,Five
10,Follow You Home,£21.36,In stock,One
10,First Steps for New Christians (Print Edition),£29.00,In stock,One
10,Finders Keepers (Bill Hodges Trilogy #2),£53.53,In stock,Five
10,"Fables, Vol. 1: Legends in Exile (Fables #1)",£41.62,In stock,Four
10,Eureka Trivia 6.0,£54.59,In stock,Four
10,Drive: The Surprising Truth About What Motivates Us,£34.95,In stock,Four
10,Done Rubbed Out (Reightman & Bailey #1),£37.72,In stock,Five
10,Doing It Over (Most Likely To #1),£35.61,In stock,Three
10,"Deliciously Ella Every Day: Quick and Easy Recipes for Gluten-Free Snacks, Packed Lunches, and Simple Meals",£42.16,In stock,Three
11,Dark Notes,£19.19,In stock,Five
11,"Daring Greatly: How the Courage to Be Vulnerable Transforms the Way We Live, Love, Parent, and Lead",£19.43,In stock,Three
11,Close to You,£49.46,In stock,Four
11,Chasing Heaven: What Dying Taught Me About Living,£37.80,In stock,Two
11,Big Magic: Creative Living Beyond Fear,£30.80,In stock,Three
11,Becoming Wise: An Inquiry into the Mystery and Art of Living,£27.43,In stock,Two
11,Beauty Restored (Riley Family Legacy Novellas #3),£11.11,In stock,Two
11,Batman: The Long Halloween (Batman),£36.50,In stock,Two
11,Batman: The Dark Knight Returns (Batman),£15.38,In stock,Five
11,Ayumi's Violin,£15.48,In stock,Two
11,Anonymous,£46.82,In stock,Four
11,Amy Meets the Saints and Sages,£18.46,In stock,Three
11,Amid the Chaos,£36.58,In stock,One
11,Amatus,£50.54,In stock,Five
11,Agnostic: A Spirited Manifesto,£12.51,In stock,Five
11,Zealot: The Life and Times of Jesus of Nazareth,£24.70,In stock,Three
11,You (You #1),£43.61,In stock,Five
11,"Wonder Woman: Earth One, Volume One (Wonder Woman: Earth One #1)",£37.34,In stock,Four
11,Wild Swans,£14.36,In stock,Two
11,Why the Right Went Wrong: Conservatism--From Goldwater to the Tea Party and Beyond,£52.65,In stock,Four
12,Whole Lotta Creativity Going On: 60 Fun and Unusual Exercises to Awaken and Strengthen Your Creativity,£38.20,In stock,Four
12,What's It Like in Space?: Stories from Astronauts Who've Been There,£19.60,In stock,Two
12,"We Are Robin, Vol. 1: The Vigilante Business (We Are Robin #1)",£53.90,In stock,One
12,Walt Disney's Alice in Wonderland,£12.96,In stock,Five
12,V for Vendetta (V for Vendetta Complete),£37.10,In stock,Four
12,Until Friday Night (The Field Party #1),£46.31,In stock,Two
12,"Unbroken: A World War II Story of Survival, Resilience, and Redemption",£45.95,In stock,Two
12,Twenty Yawns,£22.08,In stock,Two
12,Through the Woods,£25.38,In stock,Two
12,This Is Where It Ends,£27.12,In stock,Two
12,The Year of Magical Thinking,£43.04,In stock,Two
12,The Wright Brothers,£56.80,In stock,Four
12,The White Queen (The Cousins' War #1),£25.91,In stock,Five
12,The Wedding Pact (The O'Malleys #2),£32.61,In stock,Three
12,The Time Keeper,£27.88,In stock,Five
12,The Testament of Mary,£52.67,In stock,Four
12,The Star-Touched Queen,£46.02,In stock,Five
12,The Songs of the Gods,£44.48,In stock,Five
12,The Song of Achilles,£37.40,In stock,Five
12,The Rosie Project (Don Tillman #1),£54.04,In stock,One
13,The Power of Habit: Why We Do What We Do in Life and Business,£16.88,In stock,Three
13,The Marriage of Opposites,£28.08,In stock,Four
13,The Lucifer Effect: Understanding How Good People Turn Evil,£10.40,In stock,One
13,The Long Haul (Diary of a Wimpy Kid #9),£44.07,In stock,One
13,The Loney,£23.40,In stock,One
13,The Literature Book (Big Ideas Simply Explained),£17.43,In stock,Three
13,The Last Mile (Amos Decker #2),£54.21,In stock,Two
13,The Immortal Life of Henrietta Lacks,£40.67,In stock,Two
13,The Hidden Oracle (The Trials of Apollo #1),£52.26,In stock,Two
13,The Help Yourself Cookbook for Kids: 60 Easy Plant-Based Recipes Kids Can Make to Stay Healthy and Save the Earth,£28.77,In stock,Three
13,The Guilty (Will Robie #4),£13.82,In stock,Two
13,The First Hostage (J.B. Collins #2),£25.85,In stock,Three
13,The Dovekeepers,£48.78,In stock,One
13,The Darkest Lie,£35.35,In stock,Five
13,The Bane Chronicles (The Bane Chronicles #1-11),£44.73,In stock,Four
13,The Bad-Ass Librarians of Timbuktu: And Their Race to Save the World’s Most Precious Manuscripts,£15.77,In stock,One
13,The 14th Colony (Cotton Malone #11),£39.24,In stock,One
13,That Darkness (Gardiner and Renner #1),£13.92,In stock,One
13,Tastes Like Fear (DI Marnie Rome #3),£10.69,In stock,One
13,Take Me with You,£45.21,In stock,Three
14,Swell: A Year of Waves,£45.58,In stock,One
14,Superman Vol. 1: Before Truth (Superman by Gene Luen Yang #1),£11.89,In stock,Five
14,Still Life with Bread Crumbs,£26.41,In stock,Three
14,Steve Jobs,£39.50,In stock,Five
14,Sorting the Beef from the Bull: The Science of Food Fraud Forensics,£44.74,In stock,Four
14,Someone Like You (The Harrisons #2),£52.79,In stock,Five
14,"So Cute It Hurts!!, Vol. 6 (So Cute It Hurts!! #6)",£35.43,In stock,Four
14,Shtum,£55.84,In stock,Four
14,See America: A Celebration of Our National Parks & Treasured Sites,£48.87,In stock,Three
14,salt.,£46.78,In stock,Four
14,Robin War,£47.82,In stock,Three
14,"Red Hood/Arsenal, Vol. 1: Open for Business (Red Hood/Arsenal #1)",£25.48,In stock,Two
14,Rain Fish,£23.57,In stock,Three
14,"Quarter Life Poetry: Poems for the Young, Broke and Hangry",£50.89,In stock,Five
14,Pet Sematary,£10.56,In stock,Three
14,"Overload: How to Unplug, Unwind, and Unleash Yourself from the Pressure of Stress",£52.15,In stock,Three
14,Once Was a Time,£18.28,In stock,Two
14,Old School (Diary of a Wimpy Kid #10),£11.83,In stock,Five
14,No Dream Is Too High: Life Lessons From a Man Who Walked on the Moon,£21.95,In stock,Two
14,"Naruto (3-in-1 Edition), Vol. 14: Includes Vols. 40, 41 & 42 (Naruto: Omnibus #14)",£38.39,In stock,Two
15,My Name Is Lucy Barton,£41.56,In stock,One
15,My Mrs. Brown,£24.48,In stock,Three
15,My Kind of Crazy,£40.36,In stock,One
15,Mr. Mercedes (Bill Hodges Trilogy #1),£28.90,In stock,One
15,More Than Music (Chasing the Dream #1),£37.61,In stock,Two
15,Made to Stick: Why Some Ideas Survive and Others Die,£38.85,In stock,Five
15,Luis Paints the World,£53.95,In stock,Three
15,Luckiest Girl Alive,£49.83,In stock,Three
15,Lowriders to the Center of the Earth (Lowriders in Space #2),£51.51,In stock,Two
15,Love Is a Mix Tape (Music #1),£18.03,In stock,One
15,Looking for Lovely: Collecting the Moments that Matter,£29.14,In stock,Five
15,"Living Leadership by Insight: A Good Leader Achieves, a Great Leader Builds Monuments",£46.91,In stock,Four
15,Let It Out: A Journey Through Journaling,£26.79,In stock,Five
15,Lady Midnight (The Dark Artifices #1),£16.28,In stock,Five
15,"It's All Easy: Healthy, Delicious Weeknight Meals in under 30 Minutes",£19.55,In stock,One
15,Island of Dragons (Unwanteds #7),£29.65,In stock,One
15,I Know What I'm Doing -- and Other Lies I Tell Myself: Dispatches from a Life Under Construction,£25.98,In stock,Four
15,I Am Pilgrim (Pilgrim #1),£10.60,In stock,Four
15,"Hyperbole and a Half: Unfortunate Situations, Flawed Coping Mechanisms, Mayhem, and Other Things That Happened",£14.75,In stock,Five
15,"Hush, Hush (Hush, Hush #1)",£47.02,In stock,Three
16,Hold Your Breath (Search and Rescue #1),£28.82,In stock,One
16,Hamilton: The Revolution,£58.79,In stock,Three
16,Greek Mythic History,£10.23,In stock,Five
16,God: The Most Unpleasant Character in All Fiction,£30.03,In stock,Five
16,Glory over Everything: Beyond The Kitchen House,£45.84,In stock,Three
16,Feathers: Displays of Brilliant Plumage,£49.05,In stock,Three
16,"Far & Away: Places on the Brink of Change: Seven Continents, Twenty-Five Years",£15.06,In stock,Four
16,Every Last Word,£46.47,In stock,Three
16,Eligible (The Austen Project #4),£27.09,In stock,Three
16,El Deafo,£57.62,In stock,Five
16,Eight Hundred Grapes,£14.39,In stock,Four
16,"Eaternity: More than 150 Deliciously Easy Vegan Recipes for a Long, Healthy, Satisfied, Joyful Life",£51.75,In stock,Five
16,"Eat Fat, Get Thin",£54.07,In stock,Two
16,Don't Get Caught,£55.35,In stock,One
16,Doctor Sleep (The Shining #2),£40.12,In stock,Two
16,Demigods & Magicians: Percy and Annabeth Meet the Kanes (Percy Jackson & Kane Chronicles Crossover #1-3),£37.51,In stock,Five
16,Dear Mr. Knightley,£11.21,In stock,Five
16,Daily Fantasy Sports,£36.58,In stock,One
16,Crazy Love: Overwhelmed by a Relentless God,£47.72,In stock,Two
16,Cometh the Hour (The Clifton Chronicles #6),£25.01,In stock,Three
17,Code Name Verity (Code Name Verity #1),£22.13,In stock,Four
17,Clockwork Angel (The Infernal Devices #1),£44.14,In stock,One
17,City of Glass (The Mortal Instruments #3),£56.02,In stock,Four
17,City of Fallen Angels (The Mortal Instruments #4),£11.23,In stock,Four
17,City of Bones (The Mortal Instruments #1),£43.28,In stock,One
17,City of Ashes (The Mortal Instruments #2),£47.27,In stock,One
17,Cell,£20.29,In stock,Four
17,Catching Jordan (Hundred Oaks),£50.83,In stock,Three
17,"Carry On, Warrior: Thoughts on Life Unarmed",£31.85,In stock,Three
17,Carrie,£46.23,In stock,Two
17,Buying In: The Secret Dialogue Between What We Buy and Who We Are,£37.80,In stock,Four
17,Brain on Fire: My Month of Madness,£49.32,In stock,Five
17,Batman: Europa,£32.01,In stock,Two
17,Barefoot Contessa Back to Basics,£28.01,In stock,One
17,Barefoot Contessa at Home: Everyday Recipes You'll Make Over and Over Again,£50.62,In stock,Five
17,Balloon Animals,£17.03,In stock,Three
17,Art Ops Vol. 1,£48.80,In stock,Three
17,Aristotle and Dante Discover the Secrets of the Universe (Aristotle and Dante Discover the Secrets of the Universe #1),£58.14,In stock,Four
17,Angels Walking (Angels Walking #1),£34.20,In stock,Two
17,Angels & Demons (Robert Langdon #1),£51.48,In stock,Three
18,All the Light We Cannot See,£29.87,In stock,Five
18,"Adulthood Is a Myth: A ""Sarah's Scribbles"" Collection",£10.90,In stock,Two
18,Abstract City,£56.37,In stock,Five
18,A Time of Torment (Charlie Parker #14),£48.35,In stock,Five
18,A Study in Scarlet (Sherlock Holmes #1),£16.73,In stock,Two
18,"A Series of Catastrophes and Miracles: A True Story of Love, Science, and Cancer",£56.48,In stock,Two
18,A People's History of the United States,£40.79,In stock,Two
18,A Man Called Ove,£39.72,In stock,One
18,A Distant Mirror: The Calamitous 14th Century,£14.58,In stock,Three
18,A Brush of Wings (Angels Walking #3),£55.51,In stock,One
18,1491: New Revelations of the Americas Before Columbus,£21.80,In stock,Three
18,"The Three Searches, Meaning, and the Story",£13.33,In stock,Three
18,Searching for Meaning in Gailana,£38.73,In stock,One
18,Rook,£37.86,In stock,Four
18,My Kitchen Year: 136 Recipes That Saved My Life,£11.53,In stock,Two
18,13 Hours: The Inside Account of What Really Happened In Benghazi,£27.06,In stock,One
18,Will You Won't You Want Me?,£13.86,In stock,Three
18,Tipping Point for Planet Earth: How Close Are We to the Edge?,£37.55,In stock,One
18,The Star-Touched Queen,£32.30,In stock,Five
18,The Silent Sister (Riley MacPherson #1),£46.29,In stock,Five
19,The Midnight Watch: A Novel of the Titanic and the Californian,£26.20,In stock,One
19,The Lonely City: Adventures in the Art of Being Alone,£33.26,In stock,Two
19,The Gray Rhino: How to Recognize and Act on the Obvious Dangers We Ignore,£59.15,In stock,Four
19,The Golden Condom: And Other Essays on Love Lost and Found,£39.43,In stock,One
19,The Epidemic (The Program 0.6),£14.44,In stock,Five
19,The Dinner Party,£56.54,In stock,Two
19,The Diary of a Young Girl,£59.90,In stock,Three
19,The Children,£11.88,In stock,Three
19,Stars Above (The Lunar Chronicles #4.5),£48.05,In stock,Two
19,Snatched: How A Drug Queen Went Undercover for the DEA and Was Kidnapped By Colombian Guerillas,£21.21,In stock,Three
19,Raspberry Pi Electronics Projects for the Evil Genius,£49.67,In stock,Four
19,Quench Your Own Thirst: Business Lessons Learned Over a Beer or Two,£43.14,In stock,One
19,Psycho: Sanitarium (Psycho #1.5),£36.97,In stock,Five
19,Poisonous (Max Revere Novels #3),£26.80,In stock,Three
19,One with You (Crossfire #5),£15.71,In stock,Four
19,No Love Allowed (Dodge Cove #1),£54.65,In stock,Four
19,Murder at the 42nd Street Library (Raymond Ambler #1),£54.36,In stock,Four
19,Most Wanted,£35.28,In stock,Three
19,"Love, Lies and Spies",£20.55,In stock,Two
19,How to Speak Golf: An Illustrated Guide to Links Lingo,£58.32,In stock,Five
20,Hide Away (Eve Duncan #20),£11.84,In stock,One
20,Furiously Happy: A Funny Book About Horrible Things,£41.46,In stock,Four
20,Everyday Italian: 125 Simple and Delicious Recipes,£20.10,In stock,Five
