Page,Title,Price,Availability,Rating
20,Equal Is Unfair: America's Misguided Fight Against Income Inequality,£56.86,In stock,One
20,Eleanor & Park,£56.51,In stock,Five
20,Dirty (Dive Bar #1),£40.83,In stock,Four
20,Can You Keep a Secret? (Fear Street Relaunch #4),£48.64,In stock,One
20,Boar Island (Anna Pigeon #19),£59.48,In stock,Three
20,A Paris Apartment,£39.01,In stock,Four
20,"A la Mode: 120 Recipes in 60 Pairings: Pies, Tarts, Cakes, Crisps, and More Topped with Ice Cream, Gelato, Frozen Custard, and More",£38.77,In stock,One
20,Troublemaker: Surviving Hollywood and Scientology,£48.39,In stock,Two
20,The Widow,£27.26,In stock,Two
20,"The Sleep Revolution: Transforming Your Life, One Night at a Time",£11.68,In stock,Four
20,The Improbability of Love,£59.45,In stock,One
20,The Art of Startup Fundraising,£21.00,In stock,Three
20,Take Me Home Tonight (Rock Star Romance #3),£53.98,In stock,Three
20,Sleeping Giants (Themis Files #1),£48.74,In stock,One
20,"Setting the World on Fire: The Brief, Astonishing Life of St. Catherine of Siena",£21.15,In stock,Two
20,Playing with Fire,£13.71,In stock,Three
20,Off the Hook (Fishing for Trouble #1),£47.67,In stock,Three
21,Mothering Sunday,£13.34,In stock,Two
21,"Mother, Can You Not?",£16.89,In stock,Five
21,M Train,£27.18,In stock,One
21,Lilac Girls,£17.28,In stock,Two
21,Lies and Other Acts of Love,£45.14,In stock,One
21,Lab Girl,£40.85,In stock,One
21,Keep Me Posted,£20.46,In stock,Four
21,It Didn't Start with You: How Inherited Family Trauma Shapes Who We Are and How to End the Cycle,£56.27,In stock,Three
21,Grey (Fifty Shades #4),£48.49,In stock,Four
21,"Exit, Pursued by a Bear",£51.34,In stock,Four
21,Daredevils,£16.34,In stock,Three
21,Cravings: Recipes for What You Want to Eat,£20.50,In stock,Three
21,Born for This: How to Find the Work You Were Meant to Do,£21.59,In stock,Five
21,Arena,£21.36,In stock,Four
21,Adultery,£20.88,In stock,Five
21,A Mother's Reckoning: Living in the Aftermath of Tragedy,£19.53,In stock,Three
21,A Gentleman's Position (Society of Gentlemen #3),£14.75,In stock,Five
21,11/22/63,£48.48,In stock,Three
21,"10% Happier: How I Tamed the Voice in My Head, Reduced Stress Without Losing My Edge, and Found Self-Help That Actually Works",£24.57,In stock,Two
21,10-Day Green Smoothie Cleanse: Lose Up to 15 Pounds in 10 Days!,£49.71,In stock,Five
22,Without Shame,£48.27,In stock,Five
22,Watchmen,£58.05,In stock,Four
22,Unlimited Intuition Now,£58.87,In stock,Four
22,Underlying Notes,£11.82,In stock,Two
22,The Shack,£28.03,In stock,One
22,The New Brand You: Your New Image Makes the Sale for You,£44.05,In stock,Five
22,"The Moosewood Cookbook: Recipes from Moosewood Restaurant, Ithaca, New York",£12.34,In stock,Four
22,The Flowers Lied,£16.68,In stock,Two
22,"The Fabric of the Cosmos: Space, Time, and the Texture of Reality",£55.91,In stock,One
22,The Book of Mormon,£24.57,In stock,Three
22,The Art and Science of Low Carbohydrate Living,£52.98,In stock,Five
22,The Alien Club,£54.40,In stock,One
22,Suzie Snowflake: One beautiful flake (a self-esteem story),£54.81,In stock,Five
22,Nap-a-Roo,£25.08,In stock,One
22,"NaNo What Now? Finding your editing process, revising your NaNoWriMo book and building a writing career through publishing and beyond",£10.41,In stock,Four
22,Modern Day Fables,£47.44,In stock,Two
22,If I Gave You God's Phone Number....: Searching for Spirituality in America,£20.91,In stock,One
22,"Fruits Basket, Vol. 9 (Fruits Basket #9)",£33.95,In stock,Four
22,Dress Your Family in Corduroy and Denim,£43.68,In stock,Three
22,Don't Forget Steven,£33.23,In stock,One
23,Chernobyl 01:23:40: The Incredible True Story of the World's Worst Nuclear Disaster,£35.92,In stock,Two
23,Art and Fear: Observations on the Perils (and Rewards) of Artmaking,£48.63,In stock,Four
23,A Shard of Ice (The Black Symphony Saga #1),£56.63,In stock,Three
23,A Hero's Curse (The Unseen Chronicles #1),£50.49,In stock,Three
23,23 Degrees South: A Tropical Tale of Changing Whether...,£35.79,In stock,Two
23,"Zero to One: Notes on Startups, or How to Build the Future",£34.06,In stock,Three
23,Why Not Me?,£17.76,In stock,One
23,When Breath Becomes Air,£39.36,In stock,Two
23,Vagabonding: An Uncommon Guide to the Art of Long-Term World Travel,£36.94,In stock,Two
23,The Unlikely Pilgrimage of Harold Fry (Harold Fry #1),£43.62,In stock,Five
23,The New Drawing on the Right Side of the Brain,£43.02,In stock,Three
23,"The Midnight Assassin: Panic, Scandal, and the Hunt for America's First Serial Killer",£28.45,In stock,Four
23,The Martian (The Martian #1),£41.39,In stock,Two
23,The High Mountains of Portugal,£51.15,In stock,One
23,The Grownup,£35.88,In stock,One
23,The E-Myth Revisited: Why Most Small Businesses Don't Work and What to Do About It,£36.91,In stock,One
23,South of Sunshine,£28.93,In stock,One
23,Smarter Faster Better: The Secrets of Being Productive in Life and Business,£38.89,In stock,Five
23,Silence in the Dark (Logan Point #4),£58.33,In stock,Three
23,Shadows of the Past (Logan Point #1),£39.67,In stock,Five
24,Roller Girl,£14.10,In stock,Five
24,Rising Strong,£21.82,In stock,Three
24,Proofs of God: Classical Arguments from Tertullian to Barth,£54.21,In stock,One
24,Please Kill Me: The Uncensored Oral History of Punk,£31.19,In stock,Four
24,Out of Print: City Lights Spotlight No. 14,£53.64,In stock,Five
24,My Life Next Door (My Life Next Door ),£36.39,In stock,Five
24,Miller's Valley,£58.54,In stock,Two
24,Man's Search for Meaning,£29.48,In stock,Three
24,"Love That Boy: What Two Presidents, Eight Road Trips, and My Son Taught Me About a Parent's Expectations",£25.06,In stock,Two
24,Living Forward: A Proven Plan to Stop Drifting and Get the Life You Want,£12.55,In stock,Three
24,Les Fleurs du Mal,£29.04,In stock,Five
24,Left Behind (Left Behind #1),£40.72,In stock,Two
24,Kill 'Em and Leave: Searching for James Brown and the American Soul,£45.05,In stock,Five
24,Kierkegaard: A Christian Missionary to Christians,£47.13,In stock,One
24,John Vassos: Industrial Design for Modern Life,£20.22,In stock,Four
24,I'll Give You the Sun,£56.48,In stock,One
24,I Will Find You,£44.21,In stock,One
24,Hystopia: A Novel,£21.96,In stock,Four
24,Howl and Other Poems,£40.45,In stock,Two
24,History of Beauty,£10.29,In stock,Four
25,Heaven is for Real: A Little Boy's Astounding Story of His Trip to Heaven and Back,£52.86,In stock,Two
25,Future Shock (Future Shock #1),£55.65,In stock,Five
25,Ender's Game (The Ender Quintet #1),£43.64,In stock,One
25,Diary of a Citizen Scientist: Chasing Tiger Beetles and Other New Ways of Engaging the World,£28.41,In stock,One
25,Death by Leisure: A Cautionary Tale,£37.51,In stock,Four
25,Brilliant Beacons: A History of the American Lighthouse,£11.45,In stock,Three
25,Brazen: The Courage to Find the You That's Been Hiding,£19.22,In stock,Two
25,Between the World and Me,£56.91,In stock,Four
25,Being Mortal: Medicine and What Matters in the End,£55.06,In stock,Four
25,"A Murder Over a Girl: Justice, Gender, Junior High",£13.20,In stock,Three
25,32 Yolks,£53.63,In stock,Two
25,"""Most Blessed of the Patriarchs"": Thomas Jefferson and the Empire of the Imagination",£44.48,In stock,Five
25,You Are a Badass: How to Stop Doubting Your Greatness and Start Living an Awesome Life,£12.08,In stock,Three
25,Wildlife of New York: A Five-Borough Coloring Book,£22.14,In stock,Two
25,What Happened on Beale Street (Secrets of the South Mysteries #2),£25.37,In stock,Five
25,Unreasonable Hope: Finding Faith in the God Who Brings Purpose to Your Pain,£46.33,In stock,Two
25,Under the Tuscan Sun,£37.33,In stock,Three
25,Toddlers Are A**holes: It's Not Your Fault,£25.55,In stock,One
25,The Year of Living Biblically: One Man's Humble Quest to Follow the Bible as Literally as Possible,£34.72,In stock,One
25,The Whale,£35.96,In stock,Four
26,The Story of Art,£41.14,In stock,Four
26,The Origin of Species,£10.01,In stock,Four
26,The Great Gatsby,£36.05,In stock,Four
26,The Good Girl,£49.03,In stock,Three
26,The Glass Castle,£16.24,In stock,One
26,The Faith of Christopher Hitchens: The Restless Soul of the World's Most Notorious Atheist,£39.55,In stock,One
26,The Drowning Girls,£35.67,In stock,Three
26,The Constant Princess (The Tudor Court #1),£16.62,In stock,Three
26,The Bourne Identity (Jason Bourne #1),£42.78,In stock,Four
26,The Bachelor Girl's Guide to Murder (Herringford and Watts Mysteries #1),£52.30,In stock,Five
26,The Art Book,£32.34,In stock,Two
26,The 7 Habits of Highly Effective People: Powerful Lessons in Personal Change,£33.17,In stock,Four
26,Team of Rivals: The Political Genius of Abraham Lincoln,£20.12,In stock,Five
26,Steal Like an Artist: 10 Things Nobody Told You About Being Creative,£20.90,In stock,Two
26,"Sit, Stay, Love",£20.90,In stock,Three
26,Sister Dear,£40.20,In stock,Four
26,"Shrunken Treasures: Literary Classics, Short, Sweet, and Silly",£52.87,In stock,Three
26,"Rich Dad, Poor Dad",£51.74,In stock,One
26,Raymie Nightingale,£34.41,In stock,Two
26,Playing from the Heart,£32.38,In stock,One
27,Nightstruck: A Novel,£50.35,In stock,Four
27,"Naturally Lean: 125 Nourishing Gluten-Free, Plant-Based Recipes--All Under 300 Calories",£11.38,In stock,Five
27,Meternity,£43.58,In stock,Three
27,Memoirs of a Geisha,£49.67,In stock,Three
27,Like Never Before (Walker Family #2),£28.77,In stock,Two
27,Life of Pi,£13.22,In stock,Four
27,Leave This Song Behind: Teen Poetry at Its Best,£51.17,In stock,Five
27,King's Folly (The Kinsman Chronicles #1),£39.61,In stock,Five
27,John Adams,£57.43,In stock,Four
27,How to Cook Everything Vegetarian: Simple Meatless Recipes for Great Food (How to Cook Everything),£46.01,In stock,Four
27,How to Be a Domestic Goddess: Baking and the Art of Comfort Cooking,£28.25,In stock,Two
27,Good in Bed (Cannie Shapiro #1),£37.05,In stock,Five
27,"Fruits Basket, Vol. 7 (Fruits Basket #7)",£19.57,In stock,One
27,For the Love: Fighting for Grace in a World of Impossible Standards,£45.13,In stock,Three
27,Finding God in the Ruins: How God Redeems Pain,£46.64,In stock,Two
27,Every Heart a Doorway (Every Heart A Doorway #1),£12.16,In stock,Five
27,Delivering the Truth (Quaker Midwife Mystery #1),£20.89,In stock,Four
27,Counted With the Stars (Out from Egypt #1),£17.97,In stock,Five
27,"Chronicles, Vol. 1",£52.60,In stock,Two
27,Blue Like Jazz: Nonreligious Thoughts on Christian Spirituality,£25.77,In stock,One
28,Benjamin Franklin: An American Life,£48.19,In stock,Three
28,"At The Existentialist Café: Freedom, Being, and apricot cocktails with: Jean-Paul Sartre, Simone de Beauvoir, Albert Camus, Martin Heidegger, Edmund Husserl, Karl Jaspers, Maurice Merleau-Ponty and others",£29.93,In stock,Five
28,A Summer In Europe,£44.34,In stock,Two
28,A Short History of Nearly Everything,£52.40,In stock,Five
28,A Gathering of Shadows (Shades of Magic #2),£44.81,In stock,Four
28,The Sound Of Love,£57.84,In stock,Five
28,The Rise and Fall of the Third Reich: A History of Nazi Germany,£39.67,In stock,Two
28,The Perks of Being a Wallflower,£55.02,In stock,Three
28,The Mysterious Affair at Styles (Hercule Poirot #1),£24.80,In stock,Four
28,The Man Who Mistook His Wife for a Hat and Other Clinical Tales,£59.45,In stock,Four
28,The Makings of a Fatherless Child,£31.58,In stock,Two
28,The Joy of Cooking,£43.27,In stock,Four
28,The Invention of Wings,£37.34,In stock,One
28,The Hobbit (Middle-Earth Universe),£17.80,In stock,Five
28,The Great Railway Bazaar,£30.54,In stock,One
28,The Golden Compass (His Dark Materials #1),£18.77,In stock,One
28,The God Delusion,£46.85,In stock,Three
28,The Girl You Left Behind (The Girl You Left Behind #1),£15.79,In stock,One
28,The Fellowship of the Ring (The Lord of the Rings #1),£10.27,In stock,Two
28,The Collected Poems of W.B. Yeats (The Collected Works of W.B. Yeats #1),£15.42,In stock,Five
29,The Barefoot Contessa Cookbook,£59.92,In stock,Five
29,Tell the Wolves I'm Home,£50.96,In stock,Two
29,Ship Leaves Harbor: Essays on Travel by a Recovering Journeyman,£30.60,In stock,Three
29,Pride and Prejudice,£19.27,In stock,Four
29,Musicophilia: Tales of Music and the Brain,£46.58,In stock,One
29,Mere Christianity,£48.51,In stock,Three
29,Me Before You (Me Before You #1),£19.02,In stock,One
29,In the Woods (Dublin Murder Squad #1),£38.38,In stock,Two
29,In Cold Blood,£49.98,In stock,Four
29,How to Stop Worrying and Start Living,£46.49,In stock,Five
29,Give It Back,£18.32,In stock,Two
29,"Girl, Interrupted",£42.14,In stock,Three
29,Fun Home: A Family Tragicomic,£56.59,In stock,Four
29,"Fruits Basket, Vol. 6 (Fruits Basket #6)",£20.96,In stock,Four
29,Deception Point,£40.32,In stock,Four
29,"Death Note, Vol. 6: Give-and-Take (Death Note #6)",£36.39,In stock,Three
29,Catherine the Great: Portrait of a Woman,£58.55,In stock,Four
29,Better Homes and Gardens New Cook Book,£39.61,In stock,Three
29,An Unquiet Mind: A Memoir of Moods and Madness,£21.30,In stock,Three
29,A Year in Provence (Provence #1),£56.88,In stock,Four
30,World Without End (The Pillars of the Earth #2),£32.97,In stock,Four
30,"Will Grayson, Will Grayson (Will Grayson, Will Grayson)",£47.31,In stock,Four
30,Why Save the Bankers?: And Other Essays on Our Economic and Political Crisis,£48.67,In stock,Two
30,Where She Went (If I Stay #2),£41.73,In stock,Four
30,What If?: Serious Scientific Answers to Absurd Hypothetical Questions,£53.68,In stock,Four
30,Two Summers,£14.64,In stock,One
30,This Is Your Brain on Music: The Science of a Human Obsession,£38.40,In stock,One
30,The Secret Garden,£15.08,In stock,Four
30,The Raven King (The Raven Cycle #4),£30.57,In stock,Two
30,The Raven Boys (The Raven Cycle #1),£57.74,In stock,Four
30,The Power Greens Cookbook: 140 Delicious Superfood Recipes,£11.05,In stock,Five
30,The Metamorphosis,£28.58,In stock,One
30,The Mathews Men: Seven Brothers and the War Against Hitler's U-boats,£42.91,In stock,Five
30,The Little Paris Bookshop,£24.73,In stock,Three
30,The Hiding Place,£55.91,In stock,Four
30,The Grand Design,£13.76,In stock,Three
30,The Firm,£45.56,In stock,Three
30,The Fault in Our Stars,£47.22,In stock,One
30,The False Prince (The Ascendance Trilogy #1),£56.00,In stock,Five
30,The Expatriates,£44.58,In stock,Two
31,The Dream Thieves (The Raven Cycle #2),£34.50,In stock,One
31,The Darkest Corners,£11.33,In stock,Five
31,The Crossover,£38.77,In stock,Four
31,The 5th Wave (The 5th Wave #1),£11.83,In stock,Two
31,Tell the Wind and Fire,£45.51,In stock,Three
31,Tell Me Three Things,£41.81,In stock,One
31,Talking to Girls About Duran Duran: One Young Man's Quest for True Love and a Cooler Haircut,£25.15,In stock,Four
31,Siddhartha,£34.22,In stock,Five
31,Shiver (The Wolves of Mercy Falls #1),£16.23,In stock,Five
31,Remember Me?,£11.48,In stock,Three
31,Red Dragon (Hannibal Lecter #1),£23.37,In stock,Three
31,Peak: Secrets from the New Science of Expertise,£16.28,In stock,Two
31,My Mother Was Nuts,£31.63,In stock,Four
31,Mexican Today: New and Rediscovered Recipes for Contemporary Kitchens,£24.91,In stock,Five
31,Maybe Something Beautiful: How Art Transformed a Neighborhood,£22.54,In stock,One
31,Lola and the Boy Next Door (Anna and the French Kiss #2),£23.63,In stock,Four
31,Logan Kade (Fallen Crest High #5.5),£13.12,In stock,Two
31,Last One Home (New Beginnings #1),£59.98,In stock,Three
31,Killing Floor (Jack Reacher #1),£31.49,In stock,Four
31,Kill the Boy Band,£15.52,In stock,Five
32,Isla and the Happily Ever After (Anna and the French Kiss #3),£48.13,In stock,Five
32,If I Stay (If I Stay #1),£38.13,In stock,Five
32,I Know Why the Caged Bird Sings (Maya Angelou's Autobiography #1),£36.55,In stock,Two
32,Harry Potter and the Deathly Hallows (Harry Potter #7),£23.32,In stock,One
32,"Fruits Basket, Vol. 5 (Fruits Basket #5)",£16.33,In stock,One
32,Foundation (Foundation (Publication Order) #1),£32.42,In stock,One
32,Fool Me Once,£16.96,In stock,One
32,Find Her (Detective D.D. Warren #8),£22.37,In stock,One
32,Evicted: Poverty and Profit in the American City,£42.27,In stock,One
32,Drama,£38.70,In stock,Two
32,Dracula the Un-Dead,£35.63,In stock,Five
32,Digital Fortress,£58.00,In stock,Five
32,"Death Note, Vol. 5: Whiteout (Death Note #5)",£52.41,In stock,One
32,"Data, A Love Story: How I Gamed Online Dating to Meet My Match",£32.35,In stock,Three
32,Critique of Pure Reason,£20.75,In stock,One
32,Booked,£17.49,In stock,Five
32,"Blue Lily, Lily Blue (The Raven Cycle #3)",£34.13,In stock,Five
32,Approval Junkie: Adventures in Caring Too Much,£58.81,In stock,Five
32,An Abundance of Katherines,£10.00,In stock,Five
32,America's War for the Greater Middle East: A Military History,£51.22,In stock,Two
33,Alight (The Generations Trilogy #2),£58.59,In stock,Four
33,A Girl's Guide to Moving On (New Beginnings #2),£31.30,In stock,One
33,A Game of Thrones (A Song of Ice and Fire #1),£46.42,In stock,Two
33,A Feast for Crows (A Song of Ice and Fire #4),£17.21,In stock,Four
33,A Clash of Kings (A Song of Ice and Fire #2),£10.79,In stock,Three
33,Vogue Colors A to Z: A Fashion Coloring Book,£52.35,In stock,Four
33,The Shining (The Shining #1),£27.88,In stock,Three
33,The Pilgrim's Progress,£50.26,In stock,Two
33,The Perfect Play (Play by Play #1),£59.99,In stock,Three
33,The Passion of Dolssa,£28.32,In stock,Five
33,The Jazz of Physics: The Secret Link Between Music and the Structure of the Universe,£38.71,In stock,Three
33,The Hunger Games (The Hunger Games #1),£29.85,In stock,Five
33,The Hound of the Baskervilles (Sherlock Holmes #5),£14.82,In stock,Two
33,The Gunning of America: Business and the Making of American Gun Culture,£16.81,In stock,Four
33,The Geography of Bliss: One Grump's Search for the Happiest Places in the World,£28.23,In stock,Two
33,The Demonists (Demonist #1),£52.11,In stock,Two
33,"The Demon Prince of Momochi House, Vol. 4 (The Demon Prince of Momochi House #4)",£27.88,In stock,Two
33,The Bone Hunters (Lexy Vaughan & Steven Macaulay #2),£59.71,In stock,Three
33,The Beast (Black Dagger Brotherhood #14),£46.08,In stock,Five
33,Some Women,£13.73,In stock,Five
34,Shopaholic Ties the Knot (Shopaholic #3),£48.39,In stock,Five
34,Paper and Fire (The Great Library #2),£49.45,In stock,Five
34,Outlander (Outlander #1),£19.67,In stock,Five
34,"Orchestra of Exiles: The Story of Bronislaw Huberman, the Israel Philharmonic, and the One Thousand Jews He Saved from Nazi Horrors",£12.36,In stock,Three
34,No One Here Gets Out Alive,£20.02,In stock,Five
34,Night Shift (Night Shift #1-20),£12.75,In stock,Four
34,Needful Things,£47.51,In stock,Four
34,Mockingjay (The Hunger Games #3),£20.44,In stock,Four
34,Misery,£34.79,In stock,Two
34,Little Women (Little Women #1),£28.07,In stock,Four
34,It,£25.01,In stock,Three
34,Harry Potter and the Sorcerer's Stone (Harry Potter #1),£13.90,In stock,Three
34,Harry Potter and the Prisoner of Azkaban (Harry Potter #3),£24.17,In stock,Four
34,Harry Potter and the Order of the Phoenix (Harry Potter #5),£31.63,In stock,Four
34,Harry Potter and the Half-Blood Prince (Harry Potter #6),£48.75,In stock,Five
34,Harry Potter and the Chamber of Secrets (Harry Potter #2),£14.74,In stock,One
34,Gone with the Wind,£32.49,In stock,Three
34,God Is Not Great: How Religion Poisons Everything,£27.80,In stock,One
34,Girl With a Pearl Earring,£26.77,In stock,One
34,"Fruits Basket, Vol. 4 (Fruits Basket #4)",£50.44,In stock,Four
35,Far From True (Promise Falls Trilogy #2),£34.93,In stock,Two
35,Dark Lover (Black Dagger Brotherhood #1),£12.87,In stock,One
35,Confessions of a Shopaholic (Shopaholic #1),£48.94,In stock,Two
35,Changing the Game (Play by Play #2),£13.38,In stock,Three
35,Candide,£58.63,In stock,Three
35,Can You Keep a Secret?,£21.94,In stock,One
35,Atlas Shrugged,£26.58,In stock,Five
35,Animal Farm,£57.22,In stock,Three
35,A Walk to Remember,£56.43,In stock,One
35,A New Earth: Awakening to Your Life's Purpose,£55.65,In stock,Five
35,"A History of God: The 4,000-Year Quest of Judaism, Christianity, and Islam",£27.62,In stock,One
35,'Salem's Lot,£49.56,In stock,Four
35,Zero History (Blue Ant #3),£34.77,In stock,One
35,Wuthering Heights,£17.73,In stock,Three
35,World War Z: An Oral History of the Zombie War,£21.80,In stock,One
35,Wild: From Lost to Found on the Pacific Crest Trail,£46.02,In stock,Three
35,"Where'd You Go, Bernadette",£18.13,In stock,One
35,When You Are Engulfed in Flames,£30.89,In stock,Five
35,We the People: The Modern-Day Figures Who Have Reshaped and Affirmed the Founding Fathers' Vision of America,£31.95,In stock,Three
35,We Are All Completely Beside Ourselves,£24.04,In stock,One
36,Walk the Edge (Thunder Road #2),£32.36,In stock,Three
36,Voyager (Outlander #3),£21.07,In stock,Five
36,Very Good Lives: The Fringe Benefits of Failure and the Importance of Imagination,£50.66,In stock,Three
36,Vegan Vegetarian Omnivore: Dinner for Everyone at the Table,£13.66,In stock,Two
36,"Unstuffed: Decluttering Your Home, Mind, and Soul",£58.09,In stock,One
36,Under the Banner of Heaven: A Story of Violent Faith,£30.00,In stock,One
36,Two Boys Kissing,£32.74,In stock,Two
36,Twilight (Twilight #1),£41.93,In stock,Two
36,Twenties Girl,£42.80,In stock,Two
36,"Trespassing Across America: One Man's Epic, Never-Done-Before (and Sort of Illegal) Hike Across the Heartland",£53.51,In stock,One
36,Three-Martini Lunch,£23.21,In stock,Three
36,"Thinking, Fast and Slow",£21.14,In stock,One
36,The Wild Robot,£56.07,In stock,Three
36,"The Wicked + The Divine, Vol. 3: Commercial Suicide (The Wicked + The Divine)",£14.41,In stock,Three
36,The Undomestic Goddess,£45.75,In stock,Four
36,The Travelers,£15.77,In stock,One
36,The Tipping Point: How Little Things Can Make a Big Difference,£10.02,In stock,Two
36,The Thing About Jellyfish,£48.77,In stock,One
36,The Stand,£57.86,In stock,Two
36,The Smitten Kitchen Cookbook,£23.59,In stock,One
37,The Silkworm (Cormoran Strike #2),£23.05,In stock,Five
37,"The Sandman, Vol. 3: Dream Country (The Sandman (volumes) #3)",£55.55,In stock,Five
37,The Rose & the Dagger (The Wrath and the Dawn #2),£58.64,In stock,Four
37,The Road to Little Dribbling: Adventures of an American in Britain (Notes From a Small Island #2),£23.21,In stock,One
37,The Rise of Theodore Roosevelt (Theodore Roosevelt #1),£42.57,In stock,Three
37,The Restaurant at the End of the Universe (Hitchhiker's Guide to the Galaxy #2),£10.92,In stock,One
37,The Rest Is Noise: Listening to the Twentieth Century,£34.77,In stock,One
37,The Red Tent,£35.66,In stock,Five
37,The Purpose Driven Life: What on Earth Am I Here for?,£37.19,In stock,Three
37,The Purest Hook (Second Circle Tattoos #3),£12.25,In stock,One
37,The Picture of Dorian Gray,£29.70,In stock,Two
37,The Paris Wife,£36.80,In stock,Three
37,The Obsession,£45.43,In stock,One
37,The Nightingale,£26.26,In stock,Four
37,The New Guy (and Other Senior Year Distractions),£44.92,In stock,Three
37,The Nanny Diaries (Nanny #1),£52.53,In stock,Five
37,The Name of God is Mercy,£37.25,In stock,Two
37,The Maze Runner (The Maze Runner #1),£20.93,In stock,One
37,The Lover's Dictionary,£58.09,In stock,Two
37,The Lonely Ones,£43.59,In stock,Five
38,The Lean Startup: How Today's Entrepreneurs Use Continuous Innovation to Create Radically Successful Businesses,£33.92,In stock,Three
38,The Last Painting of Sara de Vos,£55.55,In stock,Two
38,"The Land of 10,000 Madonnas",£29.64,In stock,Four
38,The Infinities,£27.41,In stock,One
38,The Husband's Secret,£52.51,In stock,Five
38,The Hitchhiker's Guide to the Galaxy (Hitchhiker's Guide to the Galaxy #1),£47.80,In stock,Three
38,The Guns of August,£14.54,In stock,Two
38,The Guernsey Literary and Potato Peel Pie Society,£49.53,In stock,One
38,The Goldfinch,£43.58,In stock,Three
38,The Giver (The Giver Quartet #1),£12.30,In stock,One
38,The Girl with All the Gifts,£49.47,In stock,Three
38,The Girl Who Played with Fire (Millennium Trilogy #2),£22.14,In stock,Two
38,The Girl Who Kicked the Hornet's Nest (Millennium Trilogy #3),£57.48,In stock,One
38,The Exiled,£43.45,In stock,Three
38,"The End of Faith: Religion, Terror, and the Future of Reason",£22.13,In stock,Four
38,"The Elegant Universe: Superstrings, Hidden Dimensions, and the Quest for the Ultimate Theory",£13.03,In stock,Four
38,"The Disappearing Spoon: And Other True Tales of Madness, Love, and the History of the World from the Periodic Table of the Elements",£57.35,In stock,Five
38,The Devil Wears Prada (The Devil Wears Prada #1),£44.29,In stock,One
38,The Demon-Haunted World: Science as a Candle in the Dark,£52.25,In stock,Four
38,The Day the Crayons Came Home (Crayons),£26.33,In stock,Five
39,The Da Vinci Code (Robert Langdon #2),£22.96,In stock,Two
39,The Cuckoo's Calling (Cormoran Strike #1),£19.21,In stock,One
39,The Complete Stories and Poems (The Works of Edgar Allan Poe [Cameo Edition]),£26.78,In stock,Four
39,The Complete Poems,£41.32,In stock,Five
39,The Catcher in the Rye,£24.55,In stock,One
39,The Cat in the Hat (Beginner Books B-1),£16.26,In stock,Two
39,The Case for Christ (Cases for Christianity),£47.84,In stock,One
39,The Book Thief,£53.49,In stock,Two
39,The Book of Basketball: The NBA According to The Sports Guy,£44.84,In stock,Five
39,The Blind Side: Evolution of a Game,£53.71,In stock,Five
39,The Autobiography of Malcolm X,£23.43,In stock,Two
39,"The Art of Simple Food: Notes, Lessons, and Recipes from a Delicious Revolution",£34.32,In stock,Three
39,The Art of Fielding,£22.10,In stock,One
39,"Surely You're Joking, Mr. Feynman!: Adventures of a Curious Character",£25.83,In stock,Two
39,Stiff: The Curious Lives of Human Cadavers,£36.74,In stock,Three
39,Spilled Milk: Based on a True Story,£49.51,In stock,One
39,Something Borrowed (Darcy & Rachel #1),£48.96,In stock,Five
